<?xml version="1.0" encoding="UTF-8"?>
<xmlgraph xmlns:xsi="http://www.w3.org/2001/XMLSchema-instance"
         xsi:noNamespaceSchemaLocation="../../tools/xmlgraph.xsd"
>
    <graph id="java">
        <node id="java" label="Java"/>

        <!-- java -->
        <node id="java_core" label="Core"/>
        <edge id="edge_java_core" source="java" target="java_core"/>

        <node id="java_jdk" label="JDK"/>
        <edge id="edge_java_jdk" source="java" target="java_jdk"/>

        <node id="java_ee" label="Enterprise Edition"/>
        <edge id="edge_java_ee" source="java" target="java_ee"/>

        <node id="java_spring" label="Spring Framework"/>
        <edge id="edge_java_spring" source="java" target="java_spring"/>

        <node id="java_3d_part" label="Third Party Libraries"/>
        <edge id="edge_java_3d_part" source="java" target="java_3d_part"/>

        <node id="java_persistence" label="Data Persistence"/>
        <edge id="edge_java_persistence" source="java" target="java_persistence"/>

        <node id="java_testing" label="Testing Frameworks"/>
        <edge id="edge_java_testing" source="java" target="java_testing"/>

        <!-- Java Core-->
        <node id="java_core_multithreading" label="Multithreading"/>
        <edge id="edge_java_core_multithreading" source="java_core" target="java_core_multithreading"/>

        <node id="java_core_io" label="I/O"/>
        <edge id="edge_java_core_io" source="java_core" target="java_core_io"/>

        <node id="java_core_collections" label="Collections"/>
        <edge id="edge_java_core_collections" source="java_core" target="java_core_collections"/>

        <node id="java_core_stream_api" label="Stream API"/>
        <edge id="edge_java_core_stream_api" source="java_core" target="java_core_stream_api"/>

        <node id="java_core_reflection_api" label="Reflection API"/>
        <edge id="edge_java_core_reflection_api" source="java_core" target="java_core_reflection_api"/>

        <!-- JDK -->
        <node id="java_jdk_jvm" label="JVM"/>
        <edge id="edge_java_jdk_jvm" source="java_jdk" target="java_jdk_jvm"/>

        <node id="java_jdk_tools" label="Tools"/>
        <edge id="edge_java_jdk_tools" source="java_jdk" target="java_jdk_tools"/>

        <!-- Java EE Development -->
        <node id="java_ee_ejb" label="EJB"/>
        <edge id="edge_java_ee_ejb" source="java_ee" target="java_ee_ejb"/>

        <node id="java_ee_components" label="Web Components"/>
        <edge id="edge_java_ee_components" source="java_ee" target="java_ee_components"/>

        <node id="java_ee_services" label="Web Services"/>
        <edge id="edge_java_ee_services" source="java_ee" target="java_ee_services"/>

        <!-- Spring Framework -->
        <node id="java_spring_core" label="Core"/>
        <edge id="edge_java_spring_core" source="java_spring" target="java_spring_core"/>

        <node id="java_spring_mvc" label="MVC"/>
        <edge id="edge_java_spring_mvc" source="java_spring" target="java_spring_mvc"/>

        <node id="java_spring_data" label="Data"/>
        <edge id="edge_java_spring_data" source="java_spring" target="java_spring_data"/>

        <node id="java_spring_security" label="Security"/>
        <edge id="edge_java_spring_security" source="java_spring" target="java_spring_security"/>

        <node id="java_spring_boot" label="Boot"/>
        <edge id="edge_java_spring_boot" source="java_spring" target="java_spring_boot"/>

        <node id="java_spring_cloud" label="Cloud"/>
        <edge id="edge_java_spring_cloud" source="java_spring" target="java_spring_cloud"/>

        <!-- Third Party Libraries -->
        <node id="java_3d_part_apache" label="Apache Commons"/>
        <edge id="edge_java_3d_part_apache" source="java_3d_part" target="java_3d_part_apache"/>

        <node id="java_3d_part_logging" label="Logging Libraries"/>
        <edge id="edge_java_3d_part_logging" source="java_3d_part" target="java_3d_part_logging"/>

        <node id="java_3d_part_json" label="Json Libraries"/>
        <edge id="edge_java_3d_part_json" source="java_3d_part" target="java_3d_part_json"/>

        <!-- Data Persistence -->
        <node id="java_persistence_jdbc" label="JDBC"/>
        <edge id="edge_java_persistence_jdbc" source="java_persistence" target="java_persistence_jdbc"/>

        <node id="java_persistence_jpa" label="JPA"/>
        <edge id="edge_java_persistence_jpa" source="java_persistence" target="java_persistence_jpa"/>

        <!-- JPA -->
        <node id="java_persistence_jpa_hibernate" label="Hibernate"/>
        <edge id="edge_java_persistence_jpa_hibernate" source="java_persistence_jpa" target="java_persistence_jpa_hibernate"/>

        <node id="java_persistence_jpa_eclipselink" label="EclipseLink"/>
        <edge id="edge_java_persistence_jpa_eclipselink" source="java_persistence_jpa" target="java_persistence_jpa_eclipselink"/>

        <node id="java_persistence_jpa_batis" label="iBATIS/MyBatis"/>
        <edge id="edge_java_persistence_jpa_batis" source="java_persistence_jpa" target="java_persistence_jpa_batis"/>

        <!-- Testing -->
        <node id="java_testing_testng" label="TestNG"/>
        <edge id="edge_java_testing_testng" source="java_testing" target="java_testing_testng"/>

        <node id="java_testing_junit" label="JUnit"/>
        <edge id="edge_java_testing_junit" source="java_testing" target="java_testing_junit"/>

        <node id="java_testing_mokito" label="Mokito"/>
        <edge id="edge_java_testing_mokito" source="java_testing" target="java_testing_mokito"/>
    </graph>
</xmlgraph>