<?xml version="1.0" encoding="UTF-8"?>
<xmlgraph xmlns:xsi="http://www.w3.org/2001/XMLSchema-instance"
         xsi:noNamespaceSchemaLocation="../../tools/xmlgraph.xsd"
>
    <graph id="cs">
        <node id="cs" label="Computer Science"/>

        <node id="cs_architecture" label="Architecture knowledge"/>
        <edge id="edge_cs_architecture" source="cs" target="cs_architecture"/>

        <node id="code" label="Code Standards and Code Review Process"/>
        <edge id="edge_cs_code" source="cs" target="code"/>

        <node id="cs_algorithms" label="Algorithms and data structures"/>
        <edge id="edge_cs_algorithms" source="cs" target="cs_algorithms"/>

        <node id="systems" label="Systems Programming"/>
        <edge id="edge_cs_systems" source="cs" target="systems"/>

        <node id="testing" label="Testing processes"/>
        <edge id="edge_cs_testing" source="cs" target="testing"/>

        <!-- Algorithms and data structures -->
        <node id="cs_algorithms_analysis" label="Analysis"/>
        <edge id="edge_cs_algorithms_analysis" source="cs_algorithms" target="cs_algorithms_analysis"/>

        <node id="cs_algorithms_structures" label="Data Structures"/>
        <edge id="edge_cs_algorithms_structures" source="cs_algorithms" target="cs_algorithms_structures"/>

        <node id="cs_algorithms_algorithms" label="Algorithms"/>
        <edge id="edge_cs_algorithms_algorithms" source="cs_algorithms" target="cs_algorithms_algorithms"/>

        <!--Data Structures-->
        <node id="cs_algorithms_structures_lists" label="Lists"/>
        <edge id="edge_cs_algorithms_structures_lists" source="cs_algorithms_structures" target="cs_algorithms_structures_lists"/>

        <node id="cs_algorithms_structures_stacks" label="Stacks"/>
        <edge id="edge_cs_algorithms_structures_stacks" source="cs_algorithms_structures" target="cs_algorithms_structures_stacks"/>

        <node id="cs_algorithms_structures_queues" label="Queues"/>
        <edge id="edge_cs_algorithms_structures_queues" source="cs_algorithms_structures" target="cs_algorithms_structures_queues"/>

        <node id="cs_algorithms_structures_trees" label="Trees"/>
        <edge id="edge_cs_algorithms_structures_trees" source="cs_algorithms_structures" target="cs_algorithms_structures_trees"/>

        <node id="cs_algorithms_structures_heaps" label="Heaps"/>
        <edge id="edge_cs_algorithms_structures_heaps" source="cs_algorithms_structures" target="cs_algorithms_structures_heaps"/>

        <node id="cs_algorithms_structures_graphs" label="Graphs"/>
        <edge id="edge_cs_algorithms_structures_graphs" source="cs_algorithms_structures" target="cs_algorithms_structures_graphs"/>

        <!--Algorithms-->
        <node id="cs_algorithms_structures_sorting" label="Sorting algoritms"/>
        <edge id="edge_cs_algorithms_structures_sorting" source="cs_algorithms_algorithms" target="cs_algorithms_structures_sorting"/>

        <node id="cs_algorithms_structures_research" label="Reasearch algoritms"/>
        <edge id="edge_cs_algorithms_structures_research" source="cs_algorithms_algorithms" target="cs_algorithms_structures_research"/>

        <!--Architecture knowledge-->
        <node id="cs_architecture_microservices" label="Microservices"/>
        <edge id="edge_cs_architecture_microservices" source="cs_architecture" target="cs_architecture_microservices"/>

        <node id="cs_architecture_ddd" label="Domain-Driven Design"/>
        <edge id="edge_cs_architecture_ddd" source="cs_architecture" target="cs_architecture_ddd"/>

        <node id="cs_architecture_solid" label="SOLID"/>
        <edge id="edge_cs_architecture_solid" source="cs_architecture" target="cs_architecture_solid"/>

        <node id="cs_architecture_patterns" label="Design Patterns"/>
        <edge id="edge_cs_architecture_patterns" source="cs_architecture" target="cs_architecture_patterns"/>

        <node id="cs_architecture_event" label="Event Sourcing"/>
        <edge id="edge_cs_architecture_event" source="cs_architecture" target="cs_architecture_event"/>

        <node id="cs_architecture_oop" label="Object-Oriented Programming"/>
        <edge id="edge_cs_architecture_oop" source="cs_architecture" target="cs_architecture_oop"/>

        <node id="cs_architecture_func" label="Functional Programming"/>
        <edge id="edge_cs_architecture_func" source="cs_architecture" target="cs_architecture_func"/>

        <node id="cs_architecture_distributed" label="Distributed Systems"/>
        <edge id="edge_cs_cs_architecture_distributed" source="cs_architecture" target="cs_architecture_distributed"/>

        <!--Object-Oriented Programming-->
        <node id="cs_architecture_oop_encapsulation" label="Encapsulation"/>
        <edge id="edge_cs_architecture_oop_encapsulation" source="cs_architecture_oop" target="cs_architecture_oop_encapsulation"/>

        <node id="cs_architecture_oop_inheritance" label="Inheritance"/>
        <edge id="edge_cs_architecture_oop_inheritance" source="cs_architecture_oop" target="cs_architecture_oop_inheritance"/>

        <node id="cs_architecture_oop_polymorphism" label="Polymorphism"/>
        <edge id="edge_cs_architecture_oop_polymorphism" source="cs_architecture_oop" target="cs_architecture_oop_polymorphism"/>
    </graph>
</xmlgraph>