<?xml version="1.0" encoding="UTF-8"?>
<xmlgraph xmlns:xsi="http://www.w3.org/2001/XMLSchema-instance"
         xsi:noNamespaceSchemaLocation="../../tools/xmlgraph.xsd"
>
    <graph id="net">
        <node id="net" label="Computer Network"/>

        <node id="net_osi" label="Open Systems Interconnection model"/>
        <edge id="edge_net_osi" source="net" target="net_osi"/>

        <node id="net_grpc" label="gRPC"/>
        <edge id="edge_net_grpc" source="net" target="net_grpc"/>

        <node id="net_restapi" label="REST API"/>
        <edge id="edge_net_restapi" source="net" target="net_restapi"/>

        <node id="net_graphql" label="GraphQL"/>
        <edge id="edge_net_graphql" source="net" target="net_graphql"/>

        <node id="net_soap" label="SOAP"/>
        <edge id="edge_net_soap" source="net" target="net_soap"/>

        <node id="net_dns" label="DNS"/>
        <edge id="edge_net_dns" source="net" target="net_dns"/>

        <node id="net_protocols" label="Protocols"/>
        <edge id="edge_net_protocols" source="net" target="net_protocols"/>

        <node id="net_websocket" label="Websocket"/>
        <edge id="edge_net_websocket" source="net" target="net_websocket"/>

        <node id="net_auth" label="Authorization and Authentication"/>
        <edge id="edge_net_auth" source="net" target="net_auth"/>

        <!--Protocols-->
        <node id="net_protocols_ip" label="IP"/>
        <edge id="edge_net_protocols_ip" source="net_protocols" target="net_protocols_ip"/>

        <node id="net_protocols_tcp" label="TCP"/>
        <edge id="edge_net_protocols_tcp" source="net_protocols" target="net_protocols_tcp"/>

        <node id="net_protocols_udp" label="UDP"/>
        <edge id="edge_net_protocols_udp" source="net_protocols" target="net_protocols_udp"/>

        <node id="net_protocols_http" label="HTTP"/>
        <edge id="edge_net_protocols_http" source="net_protocols" target="net_protocols_http"/>

        <node id="net_protocols_tls" label="TLS"/>
        <edge id="edge_net_protocols_tls" source="net_protocols" target="net_protocols_tls"/>

        <node id="net_protocols_ssl" label="SSL"/>
        <edge id="edge_net_protocols_ssl" source="net_protocols" target="net_protocols_ssl"/>

        <!--Authorization and Authentication-->
        <node id="net_auth_authorization" label="Authorization"/>
        <edge id="edge_net_auth_authorization" source="net_auth" target="net_auth_authorization"/>

        <node id="net_auth_authentication" label="Authentication"/>
        <edge id="edge_net_auth_authentication" source="net_auth" target="net_auth_authentication"/>

        <node id="net_auth_oauth" label="OAuth"/>
        <edge id="edge_net_auth_oauth" source="net_auth" target="net_auth_oauth"/>

        <node id="net_auth_jwt" label="JWT"/>
        <edge id="edge_net_auth_jwt" source="net_auth" target="net_auth_jwt"/>

        <node id="net_auth_cookie" label="Cookie"/>
        <edge id="edge_net_auth_cookie" source="net_auth" target="net_auth_cookie"/>
    </graph>
</xmlgraph>